{"schemaVersion":"1.0","candidateId":"80890a06-b924-5b3b-9be2-5767832b5b6d","anchorPointId":"00000000-0000-5000-8000-000000000004","operatingCycleId":"00000000-0000-5000-8000-000000000003","sensorId":"s1","eventAt":"2026-08-22T12:00:00.000Z","sourceKind":"historical_archive","status":"watch","persistenceCount":2,"episodeStartedAt":"2026-08-22T11:45:00.000Z","dataTrust":"sufficient","quality":{"status":"ok","flags":[]},"batchId":"sha256:aaaaaaaaaaaaaaaaaaaaaaaaaaaaaaaaaaaaaaaaaaaaaaaaaaaaaaaaaaaaaaaa","modelFamily":"robust-baseline","modelVersion":"1.0","foldId":"fold-1","candidateRankingVersion":"forzy-review-priority-v1"}
