{"schemaVersion":"1.0","candidateId":"7e36965b-20e4-5ce7-a37a-85357559f763","anchorPointId":"00000000-0000-5000-8000-000000000004","operatingCycleId":null,"sensorId":"s1","eventAt":"2026-08-22T12:00:00.123Z","sourceKind":"live_collection","status":"watch","persistenceCount":2,"episodeStartedAt":"2026-08-22T11:45:00.000Z","dataTrust":"sufficient","quality":{"status":"ok","flags":[]},"batchId":null,"modelFamily":"robust-baseline","modelVersion":"1.0","foldId":null,"candidateRankingVersion":"forzy-review-priority-v1"}
